{
    "about": "<span style=\"\" >This simple example illustrates the basics of the bundle format.</span>",
    "bookend": "__",
    "bridgeAPIMethods": {},
    "category": "Development",
    "creator": "Jeremiah Small",
    "description": "A very simple starter bundle.",
    "hashLoad": false,
    "id": "1D9AA724-EA93-4E6E-82B2-B83583479B93",
    "name": "Hello World",
    "offlineCompatibile": true,
    "references": [],
    "version": "2.0.0",
    "windowsTested": true
}